{
  "format": "daily-daedalus/v1",
  "policy_version": "2026-10-02",
  "generated_at": {
    "iso": "2026-10-02T08:11:00-04:00",
    "display": "Friday, October 2, 2026 · 8:11 a.m. EDT",
    "issue_label": "Layout proof · synthetic data"
  },
  "description": "Synthetic newspaper layout fixture. All stories and figures are test data, not current reporting.",
  "lead": {
    "desk_key": "technology",
    "headline": "Inference economics turn on memory movement, not just faster chips",
    "dek": "A synthetic serving study illustrates the evidence needed to connect a systems improvement to a lower cost per request.",
    "paragraphs": [
      "In this layout fixture, a hypothetical engineering team separates model loading, prefill and decoding before comparing serving paths. Faster transfer alone would not establish a production gain: queueing, cache reuse and the latency target determine how much capacity becomes usable.",
      "The mechanism belongs in the story. Moving fewer bytes between memory tiers could free bandwidth, but the result depends on model size, concurrency and context length. The illustrative comparison below is test data dated October 2, 2026, not a vendor result or a forecast."
    ],
    "source": {
      "kind": "web",
      "label": "Synthetic engineering evidence",
      "url": "https://example.org/inference-study",
      "detail": "Synthetic layout fixture, October 2, 2026"
    },
    "snapshot": {
      "columns": ["Test condition · Oct. 2", "Baseline", "Candidate"],
      "rows": [
        ["Concurrent requests", "32", "32"],
        ["Output tokens per request", "256", "256"],
        ["P95 latency budget", "2.0 s", "2.0 s"]
      ]
    }
  },
  "day_ahead": {
    "weather": {
      "status": "covered",
      "title": "Saline Weather",
      "rows": [
        {
          "day": "Fri 10/2",
          "conditions": "Partly cloudy",
          "high": "81°F",
          "low": "63°F",
          "wind": "NW 10–15",
          "precip": "20%"
        },
        {
          "day": "Sat 10/3",
          "conditions": "Mostly sunny",
          "high": "80°F",
          "low": "61°F",
          "wind": "NNE 5–10",
          "precip": "0%"
        },
        {
          "day": "Sun 10/4",
          "conditions": "Partly cloudy",
          "high": "84°F",
          "low": "66°F",
          "wind": "SW 10",
          "precip": "10%"
        },
        {
          "day": "Mon 10/5",
          "conditions": "Showers late",
          "high": "87°F",
          "low": "71°F",
          "wind": "SW 15–25",
          "precip": "30%"
        }
      ],
      "note": "Synthetic forecast rows for layout testing, issued October 2, 2026; not an actual forecast.",
      "source": {
        "kind": "web",
        "label": "National Weather Service Detroit/Pontiac",
        "url": "https://www.weather.gov/dtx/"
      }
    },
    "email_calendar": {
      "status": "covered",
      "agenda": [
        {
          "time": "7:30–9:00 a.m.",
          "event": "Gym",
          "location": "Saline"
        },
        {
          "time": "10:00–10:30 a.m.",
          "event": "Project review",
          "location": "Video call"
        },
        {
          "time": "1:00–2:00 p.m.",
          "event": "Infrastructure planning",
          "location": "Home office"
        },
        {
          "time": "6:00–9:00 p.m.",
          "event": "Softball",
          "location": "Bicentennial Park"
        },
        {
          "time": "9:15–9:30 p.m.",
          "event": "Travel checklist",
          "location": "Home"
        },
        {
          "time": "9:30–10:00 p.m.",
          "event": "Camera batteries",
          "location": "Home"
        }
      ],
      "actions": [
        {
          "title": "Model endpoint changes",
          "body": "Confirm that active deployments do not use the retiring endpoint family."
        },
        {
          "title": "New-device alert",
          "body": "Review the sign-in notification and dismiss it only if the device is recognized."
        },
        {
          "title": "Repository access review",
          "body": "Approve or decline the pending access request before tomorrow afternoon."
        },
        {
          "title": "Travel document reminder",
          "body": "Move the final itinerary copy to the offline folder."
        }
      ],
      "lookahead": [
        "Friday: evening departure; allow extra time for construction near the airport.",
        "Saturday: morning transfer followed by embarkation.",
        "Sunday: early field-weather window before afternoon showers become possible."
      ],
      "source": {
        "kind": "tool",
        "label": "Live Gmail and Google Calendar reads",
        "refs": ["gmail_mcp_server", "calendar_mcp_server"]
      }
    }
  },
  "operations_details": [
    {
      "title": "An explicitly requested incident check",
      "source": {
        "kind": "tool",
        "label": "Synthetic connected-tool evidence",
        "refs": ["k8s_mcp_server", "unifi_mcp_server"]
      },
      "blocks": [
        {
          "type": "paragraph",
          "text": "Synthetic exception for layout testing: one service is degraded as of October 2, 2026 at 8:00 a.m. EDT. This brief represents a requested bounded check, not a routine fleet survey."
        }
      ]
    }
  ],
  "departments": [
    {
      "desk_key": "technology",
      "title": "Technology",
      "stories": [
        {
          "headline": "Faster Recovery Moves Into the Serving Layer",
          "dek": "Pre-warmed engines narrow the gap between process failure and restored token service.",
          "source": {
            "kind": "web",
            "label": "NVIDIA Developer Blog",
            "url": "https://developer.nvidia.com/blog/"
          },
          "blocks": [
            {
              "type": "paragraph",
              "text": "A new recovery design keeps initialized capacity ready to take over without repeating the full model startup path. The operational value is predictable failover rather than another peak-throughput claim."
            },
            {
              "type": "briefs",
              "items": [
                {
                  "title": "Serving release",
                  "body": "The newest release reduces cold-start time and moves compiled caches under one configurable directory.",
                  "source": {
                    "kind": "web",
                    "label": "SGLang releases",
                    "url": "https://github.com/sgl-project/sglang/releases"
                  }
                },
                {
                  "title": "Security watch",
                  "body": "Tool-calling deployments should remain current and keep model-supplied arguments away from dynamic evaluation.",
                  "source": {
                    "kind": "web",
                    "label": "vLLM security advisories",
                    "url": "https://github.com/vllm-project/vllm/security/advisories"
                  }
                }
              ]
            }
          ]
        },
        {
          "headline": "Scheduler Work Shifts Toward Failure Domains",
          "source": {
            "kind": "web",
            "label": "Kubernetes blog",
            "url": "https://kubernetes.io/blog/"
          },
          "blocks": [
            {
              "type": "paragraph",
              "text": "Recent scheduler work emphasizes topology-aware placement and coordinated lifecycle behavior for distributed inference workers."
            }
          ]
        },
        {
          "headline": "Agent Evaluation Gets More Operational",
          "source": {
            "kind": "web",
            "label": "NVIDIA NeMo Agent Toolkit documentation",
            "url": "https://docs.nvidia.com/nemo/agent-toolkit/latest/"
          },
          "blocks": [
            {
              "type": "paragraph",
              "text": "Evaluation guidance increasingly connects answer quality with trajectories, latency, and repeatable regression gates."
            }
          ]
        }
      ]
    },
    {
      "desk_key": "business",
      "title": "Business",
      "stories": [
        {
          "headline": "The market comparison needs the same closing bell",
          "source": {
            "kind": "web",
            "label": "Synthetic evidence",
            "url": "https://example.org/market-fixture"
          },
          "blocks": [
            {
              "type": "paragraph",
              "text": "Synthetic prices for October 1, 2026: the example company closed at $100.25, up 1.25%; its industry benchmark gained 0.75% and the broad market 0.40%. These values test decimal preservation and are not actual security prices."
            }
          ]
        },
        {
          "headline": "A financing commitment is not a powered data center",
          "source": {
            "kind": "web",
            "label": "Synthetic evidence",
            "url": "https://example.org/financing-fixture"
          },
          "blocks": [
            {
              "type": "paragraph",
              "text": "This fictional report separates announced borrowing from drawn debt, purchased equipment and connected power. Counterparty concentration matters when several projects depend on the same customer’s future spending."
            }
          ]
        }
      ]
    },
    {
      "desk_key": "health",
      "title": "Health",
      "stories": [
        {
          "headline": "Study size and absolute risk change the headline",
          "source": {
            "kind": "web",
            "label": "Synthetic evidence",
            "url": "https://example.org/health-fixture"
          },
          "blocks": [
            {
              "type": "paragraph",